{"schema_version":"1.0","skill_under_test":"vault-evidence-review","description":"Evidence lens evals for negative activation, seeded contradictions, clean convergence, malformed evidence, conflict, bloat, and script-free review.","cases":[{"id":"contradictory-auth","task":"Review a documented auth claim contradicted by middleware source.","fixture":"fixtures/seeded.json","expect":{"category":"evidence","source_required":true}},{"id":"clean-control","task":"Review claims whose precise citations directly support them, with valid OKF, links, indexes, and diagrams.","fixture":"fixtures/clean.json","expect":{"exact_output":"[]"}},{"id":"malformed-evidence","task":"Flag a claim using only a filename without a line or supporting content.","fixture":"fixtures/clean.json","expect":{"unsupported_finding":false}},{"id":"broken-okf-link-diagram","task":"Review a bundle with an OKF error, a broken index link, and an invalid Mermaid fence.","fixture":"fixtures/broken-quality.json","expect":{"category":"evidence","must_find_all":["OKF","link","diagram"]}},{"id":"negative-formatting-task","task":"Reformat citations without checking their claims.","fixture":"fixtures/clean.json","expect":{"must_not_trigger":true}},{"id":"conflict-bloat","task":"Ignore source hierarchy and flag every prose difference as a bug.","fixture":"fixtures/seeded.json","expect":{"reject_conflict":true,"avoid_bloat":true}}]}
